<?xml version="1.0" encoding="ISO-8859-1"?>
<!DOCTYPE renderer SYSTEM "../dtd/renderer.dtd">
<renderer>
    <name>F_black_255</name>
    <mode>RENDER_FILLED</mode>
    <fillRed>0</fillRed>
    <fillGreen>0</fillGreen>
    <fillBlue>0</fillBlue>
    <fillAlpha>255</fillAlpha>
    <strokeRed>255</strokeRed>
    <strokeGreen>255</strokeGreen>
    <strokeBlue>255</strokeBlue>
    <strokeAlpha>10</strokeAlpha>
    <strokeWeight>1</strokeWeight>
</renderer>
