<?xml version="1.0" encoding="ISO-8859-1"?>
<!DOCTYPE renderer SYSTEM "../dtd/renderer.dtd">
<renderer>
    <name>PT_black_.1_10</name>
    <mode>RENDER_POINTS</mode>
    <fillRed>250</fillRed>
    <fillGreen>20</fillGreen>
    <fillBlue>100</fillBlue>
    <fillAlpha>200</fillAlpha>
    <strokeRed>0</strokeRed>
    <strokeGreen>0</strokeGreen>
    <strokeBlue>0</strokeBlue>
    <strokeAlpha>10</strokeAlpha>
    <strokeWeight>.1</strokeWeight>
</renderer>
